pid,label,short_description,description,taxon_group,ecosystem_type,link,accessibility,contact_email,jurisdiction,spatial_data_type,keywords,data_product_type,cell_size,organization_individual,closed_consent_received,temporal_coverage,order,layout,collection,thumbnail,full
nasaearthsci,NASA Earth Science Data,"NASA Earth science data are vital components of investigations into biological diversity, species distribution, and ecological conservation.","NASA Earth science data are vital components of investigations into biological diversity, species distribution, and ecological conservation.
NASA collaborates with other federal entities and international space organizations, including NOAA, USGS, the Japan Aerospace Exploration Agency (JAXA) and Ministry of Economy, Trade, and Industry (METI), and the European Space Agency (ESA), to provide data used in understanding a number of biological phenomena, including vegetation characteristics and change, biodiversity, the impacts of human activities on the natural environment, and habitat suitability. Some of these phenomena can be detected directly through remote Earth observation. For instance, forest loss can be tracked by comparing satellite imagery across time, and the distribution of ecosystems and species can directly be detected by the color signatures that characterize them. Species-specific detection is challenging with multispectral data due to the coarse spatial resolution; however, with hyperspectral data (having a high spectral resolution), the unique spectral fingerprint each species has can provide species-specific information for vegetation mapping and individual species identification.",all,Marine|Terrestrial|Freshwater,https://www.earthdata.nasa.gov/learn/pathfinders/biological-diversity-and-ecological-forecasting-data-pathfinder,Unknown,,United States,Raster|Vector,vegetation characteristics|spectroscopy|human impacts|species distribution|species occurrence|land surface characteristics|land cover dynamics|land surface temperature|precipitation|soil moisture|snow cover|topography|sea surface temperature/salinity|image|environmental,Data portal,,Organization,,,26,data_item,inputs,/img/derivatives/simple/nasaearthsci/thumbnail.jpg,/img/derivatives/simple/nasaearthsci/fullwidth.jpg
nfi,National Forest Inventory,"The National Forest Inventory (NFI) is being implemented to assess and monitor the extent, state, and sustainable development of Canada's forests in a timely and accurate manner.","The National Forest Inventory (NFI) is being implemented to assess and monitor the extent, state, and sustainable development of Canada's forests in a timely and accurate manner. Information is collected to a set of uniform standards, enabling consistent reporting across the country on the extent and state of Canada's land base to establish a baseline of where the forest resources are and how they are changing over time. In addition to providing consistent estimates for traditional forest inventory attributes, the NFI provides a framework for collecting additional data relevant to sustainable development, forest health, biodiversity and forest productivity.",vegetation,Terrestrial,https://nfi.nfis.org/en/data_and_tools,By Request,https://nfi.nfis.org/en/datarequestform,Canada,Polygon,forests|environmental,Data portal,,Organization,,,27,data_item,inputs,/img/derivatives/simple/nfi/thumbnail.jpg,/img/derivatives/simple/nfi/fullwidth.jpg
nhn,National Hydro Network,The National Hydro Network (NHN) focuses on providing a quality geometric description and a set of basic attributes describing Canada's inland surface waters.,"The National Hydro Network (NHN) focuses on providing a quality geometric description and a set of basic attributes describing Canada's inland surface waters. It provides geospatial digital data compliant with the NHN Standard such as lakes, reservoirs, watercourses (rivers and streams), canals, islands, drainage linear network, toponyms or geographical names, constructions and obstacles related to surface waters, etc. The best available federal and provincial data are used for its production, which is done jointly by the federal and interested provincial and territorial partners. The NHN is created from existing data at the 1:50 000 scale or better. The NHN data have a great potential for analysis, cartographic representation and display and will serve as base data in many applications. The NHN Work Unit Limits were created based on Water Survey of Canada Sub-Sub-Drainage Area",not applicable,Freshwater,https://open.canada.ca/data/en/dataset/a4b190fe-e090-4e6d-881e-b87956c07977,Free,,Canada,Vector,NHN|GeoBase|Hydrographic Network|earth sciences|geography|hydrology|water|network|hydrography|hydro|rivers|lakes|coastline|drainage|surface water|Geographic Information Systems|cartography|geographic data|watershed|watercourse|natural resources|environmental,Dataset,,Organization,,,28,data_item,inputs,/img/derivatives/simple/nhn/thumbnail.jpg,/img/derivatives/simple/nhn/fullwidth.jpg
nativeland,Native Land,"Native Land is an app to help map Indigenous territories, treaties, and languages.","Native Land is an app to help map Indigenous territories, treaties, and languages. We strive to map Indigenous lands in a way that changes, challenges, and improves the way people see history and the present day. We hope to strengthen the spiritual bonds that people have with the land, its people, and its meaning.",not applicable,Terrestrial,https://native-land.ca/,Free,,Global|Canada,Polygon,Native Land|Indigenous territories|Indigenous treaties|Indigenous languages,Data project,,Organization,,,29,data_item,inputs,/img/derivatives/simple/nativeland/thumbnail.jpg,/img/derivatives/simple/nativeland/fullwidth.jpg
naturewatch,NatureWatch,"NatureWatch is your home page for fun, easy-to-use environmental monitoring programs that encourage you to learn about the environment while gathering the information that scientists need to monitor and protect it.","Do you like to explore and examine the natural world? Want to be a citizen scientist? Are you interested in joining researchers and nature enthusiasts from across Canada in tracking rapid changes in our natural environment?
NatureWatch is your home page for fun, easy-to-use environmental monitoring programs that encourage you to learn about the environment while gathering the information that scientists need to monitor and protect it. NatureWatch monitoring program are suitable for all levels and interests, designed to develop your scientific observation and data collection skills so that you can actively contribute to scientific understanding of Canada’s environment.",worms|frogs|milkweed|plants|ice|snow,Freshwater|Terrestrial,https://www.naturewatch.ca/,Free,,Canada,Point,citizen science|occurrence,Data project,,Organization,,,30,data_item,inputs,/img/derivatives/simple/naturewatch/thumbnail.jpg,/img/derivatives/simple/naturewatch/fullwidth.jpg
nbefi,New Brunswick Enhanced Forest Inventory,An enhanced version of the forest inventory.,An enhanced version of the forest inventory,vegetation,Terrestrial,,Restricted,Unknown,NB,Polygon,environmental,Dataset,,Organization,,,31,data_item,inputs,/img/derivatives/simple/nbefi/thumbnail.jpg,/img/derivatives/simple/nbefi/fullwidth.jpg
nbfi,New Brunswick Forest Inventory,The Department of Natural Resources and Energy Development completes a highly detailed inventory of the forest to determine what the forest looks like across the province’s landscape.,"The Department of Natural Resources and Energy Development completes a highly detailed inventory of the forest to determine what the forest looks like across the province’s landscape. Tree species, size, quality, and quantity (volume); and broad forest types are included in the inventory. The provincial forest inventory is done on a 10-year cycle. Harvest, silvicultural and natural disturbance updates are added to the inventory annually to ensure the most current information is available. The forest inventory is the foundation of all sustainable forest management, land use planning and policy decision making.

",vegetation,Terrestrial,https://www2.gnb.ca/content/gnb/en/departments/erd/forestry-conservation/content/inventory.html,Free,,NB,Polygon,environmental,Dataset,,Organization,,,32,data_item,inputs,/img/derivatives/simple/nbfi/thumbnail.jpg,/img/derivatives/simple/nbfi/fullwidth.jpg
nberd,New Brunswick Department of Natural Resources and Energy Development Direct Access Data,"Data accessed through the URLs on this page is drawn directly from our geodatabase at the time of access.  As such, it represents the most current data the department has available at the time of access.","Data accessed through the URLs on this page is drawn directly from our geodatabase at the time of access.  As such, it represents the most current data the department has available at the time of access.",not applicable,Freshwater|Terrestrial,https://www2.gnb.ca/content/gnb/en/departments/erd/open-data/direct_access.html,Free,,NB,Raster|Vector,environmental,Data portal,,Organization,,various,33,data_item,inputs,,
noaa,NOAA National Centers for Environmental Information,"NOAA National Centers for Environmental Information is responsible for preserving, monitoring, assessing, and providing public access to the Nation's treasure of geophysical data and information.","NOAA National Centers for Environmental Information is responsible for preserving, monitoring, assessing, and providing public access to the Nation's treasure of geophysical data and information. We provide stewardship, products, and services for geophysical data from our Sun to Earth and Earth's sea floor and solid earth environment, including Earth observations from space. Active in many international programs, we offer scientists around the world access to global databases through international exchange.
",not applicable,Marine,https://www.ngdc.noaa.gov/,Free,,United States,Raster|Vector,environmental,Data portal,,Organization,,,34,data_item,inputs,/img/derivatives/simple/noaa/thumbnail.jpg,/img/derivatives/simple/noaa/fullwidth.jpg
nsfori,Nova Scotia Forest Inventory,The Nova Scotia Department of Natural Resources (NSNR&R) forest inventory program monitors many elements of today's natural resources and thereby captures changes over time.,"It is important to describe the forests of Nova Scotia today, including how they are changing over time. The Nova Scotia Department of Natural Resources (NSNR&R) forest inventory program monitors many elements of today's natural resources and thereby captures changes over time. The inventory data helps us make informed choices on sustainable forest management. The forests of Nova Scotia are monitored by two complementary measurement systems: Photo Interpretation and Permanent Forest Inventory Plots (Inventory Services). Data analysis is used to define and track many forest components, such as volume and growth, and results in various reports. The data also provides a basis for modeling volume, biomass and carbon. This valuable database is regularly shared with academia, industry and other governments.",vegetation,Terrestrial,https://novascotia.ca/natr/forestry/gis/forest-inventory.asp,Free,,NS,Polygon,forests|environmental,Dataset,,Organization,,,35,data_item,inputs,/img/derivatives/simple/nsfori/thumbnail.jpg,/img/derivatives/simple/nsfori/fullwidth.jpg
nsfn,Nova Scotia Forest Notes,I am setting up this website to help me organize information and my thinking about forests and forestry in Nova Scotia. I have spent 10+ years studying the natural history of our forests.,I am setting up this website to help me organize information and my thinking about forests and forestry in Nova Scotia. I have spent 10+ years studying the natural history of our forests.,vegetation,Terrestrial,http://nsforestnotes.ca/,Free,,NS,Unknown,forests|environmental,Data project,,Individual,,,36,data_item,inputs,/img/derivatives/simple/nsfn/thumbnail.jpg,/img/derivatives/simple/nsfn/fullwidth.jpg
nshn,Nova Scotia Hydrogeographic Network,The Nova Scotia Hydrographic Network is an enhanced version of the Nova Scotia Topographic Database's Water Features theme.,"The Nova Scotia Hydrographic Network is an enhanced version of the Nova Scotia Topographic Database's Water Features theme. This dataset includes network spines for connectivity of water flow and various attribution for flow direction, priority of water flow and toponymic objects where applicable.",not applicable,Freshwater,https://data.novascotia.ca/Environment-and-Energy/Nova-Scotia-Hydrographic-Network/dk27-q8k2,Free,,NS,Vector,watercourse|environmental,Dataset,,Organization,,,37,data_item,inputs,/img/derivatives/simple/nshn/thumbnail.jpg,/img/derivatives/simple/nshn/fullwidth.jpg
nccsc,Nature Conservancy of Canada Stream Classifcation,"This dataset contains version 2 of the Stream Classification for the Northern Appalachian – Acadian Region of Canada (New Brunswick, Nova Scotia, Prince Edward Island, and eastern Quebec) and cross-border watersheds of the United States (Maine, Vermont, New Hampshire, New York)","This dataset contains version 2 of the Stream Classification for the Northern Appalachian – Acadian Region of Canada (New Brunswick, Nova Scotia, Prince Edward Island, and eastern Quebec) and cross-border watersheds of the United States (Maine, Vermont, New Hampshire, New York). Using a seamless base hydrography layer for the region, freshwater ecosystems were classified based on five biophysical characteristics: size, gradient, alkalinity, temperature, and tidal influence.",not applicable,Freshwater,https://2c1forest.databasin.org/datasets/3fa5eb769b99496fad0c05c838c8823d/; https://hub.arcgis.com/datasets/4dcfecbda7a54d7f92b03c75679afa66_0/about,Free,,NB|NS|PE|QC,Vector,watercourse|environmental,Dataset,,Organization,,,38,data_item,inputs,/img/derivatives/simple/nccsc/thumbnail.jpg,/img/derivatives/simple/nccsc/fullwidth.jpg
obis,OBIS,"OBIS is a global open-access data and information clearing-house on marine biodiversity for science, conservation and sustainable development.","OBIS is a global open-access data and information clearing-house on marine biodiversity for science, conservation and sustainable development.",marine organisms,Marine,https://obis.org/,Free,,Global|Canada,Raster|Vector,ocean|environmental,Data portal,,Organization,,,39,data_item,inputs,/img/derivatives/simple/obis/thumbnail.jpg,/img/derivatives/simple/obis/fullwidth.jpg
otnc,Ocean Tracking Network Canada,Various open data sets of multiple species,"The Ocean Tracking Network is a global aquatic research, data management and partnership platform headquartered at Dalhousie University in Halifax, Nova Scotia, Canada. It contains various open data sets of multiple species.",all,Marine,https://oceantrackingnetwork.org/,Free,Various,Global|Canada,Raster|Vector,ocean|environmental,Data portal,,Organization,,,40,data_item,inputs,/img/derivatives/simple/otnc/thumbnail.jpg,/img/derivatives/simple/otnc/fullwidth.jpg
ocad,OceanAdapt,"This website hosts an annually updated database of scientific surveys in the United States and Canada, providing tools for exploring changes in marine fish and invertebrate distributions.","OceanAdapt is a collaboration between the Pinsky Lab of Rutgers University, the National Marine Fisheries Service (NMFS), and Fisheries and Oceans Canada (DFO) to provide information about the impacts of changing climate and other factors on the distribution of marine life to the National Climate Assessment, fisheries communities, policymakers, and to others. This website hosts an annually updated database of scientific surveys in the United States and Canada, providing tools for exploring changes in marine fish and invertebrate distributions. We are continually working to expand the site with new data and visualization tools.",fishes|invertebrates,Marine,https://oceanadapt.rutgers.edu/,Free,malin.pinsky@rutgers.edu,Global|Canada,Raster|Vector,ocean|environmental,Data project,,Organization,,,41,data_item,inputs,/img/derivatives/simple/ocad/thumbnail.jpg,/img/derivatives/simple/ocad/fullwidth.jpg
plne,PlantNet,Pl@ntNet is a citizen science project available as an app that helps you identify plants thanks to your pictures.,Pl@ntNet is a citizen science project available as an app that helps you identify plants thanks to your pictures.,plants,Terrestrial,https://plantnet.org/en/,Free,,Global|Canada,Point,plants|occurrence,Data tool,,Organization,,,42,data_item,inputs,/img/derivatives/simple/plne/thumbnail.jpg,/img/derivatives/simple/plne/fullwidth.jpg
nspem,Nova Scotia Predictive Ecosystem Mapping,Predictive ecosystem mapping for Nova Scotia: a hierarchical classification standard.,Predictive ecosystem mapping for Nova Scotia: a hierarchical classification standard.,species at risk,Terrestrial|Freshwater,Contact NS DNRR,By Request,BIODIVERSITY@novascotia.ca,NS,Vector,ecosystems|environmental,Dataset,,Organization,,,43,data_item,inputs,/img/derivatives/simple/nspem/thumbnail.jpg,/img/derivatives/simple/nspem/fullwidth.jpg
nswam,Nova Scotia Wet Areas Mapping,The WAM model predicts where water will naturally flow and/or accumulate in the landscape based on digital elevation (DEM) data and the known location of surface water bodies and wetlands.,"The WAM model predicts where water will naturally flow and/or accumulate in the landscape based on digital elevation (DEM) data and the known location of surface water bodies and wetlands. In essence, WAM is a ""cartographically derived depth-to-water index.""",not applicable,Terrestrial|Freshwater,https://novascotia.ca/natr/forestry/gis/wamdownload.asp,Free,,NS,Vector,environmental,Dataset,,Organization,,,44,data_item,inputs,/img/derivatives/simple/nswam/thumbnail.jpg,/img/derivatives/simple/nswam/fullwidth.jpg
witr,Wild Trax,"A platform to manage, store, process, share and discover biological and environmental data.","A platform to manage, store, process, share and discover biological and environmental data. WildTrax handles data from remote cameras, autonomous recording units and avian point counts but is adaptable to any sensor.",birds|mammals|animals,Terrestrial,https://www.wildtrax.ca/home,Free,,Canada,Point,remote sensing|occurrence,Data portal,,Organization,,,45,data_item,inputs,/img/derivatives/simple/witr/thumbnail.jpg,/img/derivatives/simple/witr/fullwidth.jpg
wcrp,World Climate Research Program,Climate modelling data.,"Under the World Climate Research Programme (WCRP) the Working Group on Coupled Modelling (WGCM) established the Coupled Model Intercomparison Project (CMIP) as a standard experimental protocol for studying the output of coupled atmosphere-ocean general circulation models (AOGCMs). CMIP provides a community-based infrastructure in support of climate model diagnosis, validation, intercomparison, documentation and data access.",not applicable,Unknown,https://esgf-node.llnl.gov/projects/cmip5/,Free,,Global|Canada,Unknown,climate|environmental,Data project,,Organization,,,46,data_item,inputs,/img/derivatives/simple/wcrp/thumbnail.jpg,/img/derivatives/simple/wcrp/fullwidth.jpg
worldclim,WorldClim,"Maps, graphs, tables, and data of the global climate",WorldClim is a set of global climate layers (climate grids) with a spatial resolution of about 1 square kilometer. The data can be used for mapping and spatial modeling in a GIS or with other computer programs.,not applicable,Terrestrial,https://www.worldclim.org/,Free,,Global|Canada,Raster,climate|environmental,Dataset,1 square km,Organization,,,47,data_item,inputs,/img/derivatives/simple/worldclim/thumbnail.jpg,/img/derivatives/simple/worldclim/fullwidth.jpg
trspincafoec,Tree Species in Canada's Forested Ecosystems,37 tree species mapped over forest-dominated ecosystems of Canada.,"Highly detailed (30-m spatial resolution) tree species presence and distribution maps of Canada’s forested ecosystems (2019). Products include the leading tree species as well as the class membership probabilities for 37 tree species. Also shared is the distance-to-second class (D2SC) provided as an indicator of attribution confidence. These layers were produced from a 2019 Landsat image composite, geographic and climate data, elevation derivatives, and remote sensing derived phenology. Regional classification models were generated based on Canada’s National Forest Inventory using a 150x150 km tiling system.",trees,Terrestrial,https://www.sciencedirect.com/science/article/pii/S0034425722003820,Free,,Canada,Raster,ecosystems|environmental,Dataset,30 m,Individual,,,48,data_item,inputs,/img/derivatives/simple/trspincafoec/thumbnail.jpg,/img/derivatives/simple/trspincafoec/fullwidth.jpg
aafc2020lu,2020 AAFC Semi-Decadal Land Use,The 2020 AAFC Land Use is a culmination and curated metaanalysis of several high-quality spatial datasets produced between 1990 and 2021 using a variety of methods by teams of researchers as techniques and capabilities have evolved.,"The 2020 AAFC Land Use is a culmination and curated metaanalysis of several high-quality spatial datasets produced between 1990 and 2021 using a variety of methods by teams of researchers as techniques and capabilities have evolved. The information from the input datasets was consolidated and embedded within each 30m x 30m pixel to create consolidated pixel histories, resulting in thousands of unique combinations of evidence ready for careful consideration. Informed by many sources of high-quality evidence and visual observation of imagery in Google Earth, we apply an incremental strategy to develop a coherent best current understanding of what has happened in each pixel through the time series.",vegetation,Terrestrial,https://open.canada.ca/data/en/dataset/7a098ea9-cc31-4d79-b326-89f6cd1fbb7d,Free,,Canada,Raster,crops|satellites|agriculture|farmlands|environmental,Dataset,,Organization,,1990-2021,49,data_item,inputs,/img/derivatives/simple/aafc2020lu/thumbnail.jpg,/img/derivatives/simple/aafc2020lu/fullwidth.jpg
aafcaci,AAFC Annual Crop Inventory,A national crop inventory,"Understanding the state and trends in agriculture production is essential to combat both short-term and long-term threats to stable and reliable access to food for all, and to ensure a profitable agricultural sector. Starting in 2009, the Earth Observation Team of the Science and Technology Branch (STB) at Agriculture and Agri-Food Canada (AAFC) began the process of generating annual crop type digital maps. Focusing on the Prairie Provinces in 2009 and 2010, a Decision Tree (DT) based methodology was applied using optical (Landsat-5, AWiFS, DMC) and radar (Radarsat-2) based satellite images. Beginning with the 2011 growing season, this activity has been extended to other provinces in support of a national crop inventory. To date this approach can consistently deliver a crop inventory that meets the overall target accuracy of at least 85% at a final spatial resolution of 30m (56m in 2009 and 2010).


",vegetation,Terrestrial,https://open.canada.ca/data/en/dataset/ba2645d5-4458-414d-b196-6303ac06c1c9,Free,,Canada,Raster,crops|satellites|agriculture|environmental,Dataset,,Organization,,,50,data_item,inputs,/img/derivatives/simple/aafcaci/thumbnail.jpg,/img/derivatives/simple/aafcaci/fullwidth.jpg
nsee,Nova Scotia Elevation Explorer,A Distribution System for discovering and downloading freely available LIDAR Elevation data and derived products.,A Distribution System for discovering and downloading freely available LIDAR Elevation data and derived products.,not applicable,Terrestrial|Freshwater,https://nsgi.novascotia.ca/datalocator/elevation/,Free,,NS,Raster|Vector,elevation|environmental,Data tool,,Organization,,,51,data_item,inputs,/img/derivatives/simple/nsee/thumbnail.jpg,/img/derivatives/simple/nsee/fullwidth.jpg
nsdl,Nova Scotia Data Locator,"Search for and locate maps, base data and indices at various available scales, and geographic areas around Nova Scotia including aerial photography, orthophotos, etc.","Search for and locate maps, base data and indices at various available scales, and geographic areas around Nova Scotia including aerial photography, orthophotos, etc.",not applicable,Terrestrial|Freshwater,https://nsgi.novascotia.ca/DataLocator/,Free,,NS,Raster|Vector,LiDAR|aerial photography|orth|property lines|environmental,Data tool,,Organization,,,52,data_item,inputs,,
nsplv,Nova Scotia Provincial Landscape Viewer,"The Provincial Landscape Viewer is a mapping tool developed by the Nova Scotia Department of Natural Resources (DNR) to provide easy access to ecological landscape data, along with forestry and wildlife information for natural resource planning and management.","The Provincial Landscape Viewer is a mapping tool developed by the Nova Scotia Department of Natural Resources (DNR) to provide easy access to ecological landscape data, along with forestry and wildlife information for natural resource planning and management.",all,Terrestrial|Freshwater,https://nsgi.novascotia.ca/plv/,Free,,NS,Raster|Vector,protected areas|wet areas|roads|property|forestry|crown land|wildlife|environmental,Data tool,,Organization,,,53,data_item,inputs,/img/derivatives/simple/nsplv/thumbnail.jpg,/img/derivatives/simple/nsplv/fullwidth.jpg
coex,Connect Explorer ,High Resolution Digital Aerial Photography,High Resolution Digital Aerial Photography,not applicable,Terrestrial|Freshwater,https://explorer.pictometry.com/login.php?utm_source=POL&utm_medium=Graphic&utm_campaign=Login,By Request,customersupport@eagleview.com,NS|Canada|Global,Raster,Digital Aerial Photography,Data tool,,Organization,,,54,data_item,inputs,/img/derivatives/simple/coex/thumbnail.jpg,/img/derivatives/simple/coex/fullwidth.jpg
